{
  "source_references": [
    {
      "image_path": "/absolute/path/to/reference.png",
      "role": "positive_reference"
    }
  ],
  "candidate_assets": [
    {
      "id": "asset_candidate_rainy_neon_reflection",
      "type": "lighting",
      "name": "Rainy Neon Reflection",
      "summary": "Neon light reflected on wet asphalt in a rainy night scene.",
      "tags": ["neon", "rain", "reflection", "night"],
      "profile": {
        "light_source": "neon signage",
        "surface_interaction": "wet asphalt mirror reflection"
      },
      "analysis_observations": [
        {
          "trait": "neon light reflecting across wet asphalt",
          "evidence": "magenta and cyan highlights stretch along the road surface",
          "region": "foreground street",
          "source": "visual_observation",
          "confidence": 0.86,
          "reusable": true
        }
      ],
      "excluded_observations": [
        {
          "trait": "exact storefront text",
          "evidence": "source-specific sign lettering should not be preserved",
          "source": "visual_observation",
          "confidence": 0.72,
          "reusable": false
        }
      ],
      "consensus": {
        "reference_count": 1,
        "appears_in": 1,
        "consensus_strength": 1.0,
        "common_traits": ["wet asphalt reflection", "magenta cyan neon contrast"],
        "variant_traits": [],
        "outlier_traits": []
      },
      "prompt_fragments": [
        "rain-soaked asphalt reflections",
        "magenta and cyan neon rim light"
      ],
      "negative_fragments": [
        "flat lighting",
        "dry pavement"
      ],
      "source_reference_ids": []
    }
  ],
  "recipe_candidates": [
    {
      "name": "Rainy Neon Night Lighting Recipe",
      "summary": "A source-derived recipe for rainy neon night scenes.",
      "use_cases": ["rainy city scene", "night key art"],
      "required_asset_types": ["lighting"],
      "composition_rules": [
        {
          "key": "palette_lighting_binding",
          "value": ["neon signage lighting should reflect on wet asphalt"],
          "reason": "The recipe is only useful when lighting and surface reflection stay bound."
        }
      ],
      "recommended_aspect_ratios": ["16:9", "3:4"],
      "source_reference_ids": [],
      "recipe_assets": [
        {
          "candidate_asset_id": "asset_candidate_rainy_neon_reflection",
          "role": "core",
          "weight": 0.8,
          "reason": "The lighting asset is the core reusable trait in this source image."
        }
      ],
      "confidence": 0.65,
      "source": "same_reference_image",
      "reason": "Initial recommendation inferred from source image co-occurrence."
    }
  ],
  "visual_system_candidates": [
    {
      "kind": "art_direction",
      "name": "Rainy Neon Night Visual System",
      "summary": "Suggested higher-level visual system from source-derived rainy neon assets and related existing assets.",
      "tags": ["lighting", "night", "rain"],
      "visual_rules": [
        {
          "key": "color_lighting",
          "value": ["rainy night reflections", "neon rim lighting"]
        },
        {
          "key": "composition_language",
          "value": ["wet reflective street depth"]
        }
      ],
      "avoid_rules": [
        "Avoid dry daylight scenes when preserving this visual system."
      ],
      "source_reference_ids": [],
      "candidate_asset_relations": [
        {
          "candidate_asset_id": "asset_candidate_rainy_neon_reflection",
          "role": "core",
          "weight": 0.8,
          "reason": "The lighting candidate defines the visual system anchor."
        }
      ],
      "existing_asset_relations": [],
      "related_existing_assets": [],
      "metadata": {
        "recommendation": "suggest_create",
        "reason": "Candidate assets may represent a reusable higher-level direction."
      },
      "status": "pending"
    }
  ]
}
